{
  "baseline_id": "llm_vision",
  "folio_id": "leningrad_devarim_F118B_fixture",
  "lines": [
    {
      "bbox": [
        1371,
        2,
        1392,
        113
      ],
      "line_id": "leningrad_devarim_F118B_fixture_L001",
      "llm_tie_breaks": 1,
      "llm_winner": "claude",
      "tier1": "אֵ֖ל",
      "tier2": "אֵ֖ל",
      "tier3": "אֵ֖ל",
      "tier4_records": []
    },
    {
      "bbox": [
        1547,
        2,
        1655,
        77
      ],
      "line_id": "leningrad_devarim_F118B_fixture_L002",
      "llm_tie_breaks": 0,
      "llm_winner": "claude",
      "tier1": "The text in the image is not Hebrew — it appears to be Latin script (the word \"primat\" or similar) shown upside down. There are no Hebrew characters to transcribe.",
      "tier2": "The text in the image is not Hebrew — it appears to be Latin script (the word \"primat\" or similar) shown upside down. There are no Hebrew characters to transcribe.",
      "tier3": "The text in the image is not Hebrew — it appears to be Latin script (the word \"primat\" or similar) shown upside down. There are no Hebrew characters to transcribe.",
      "tier4_records": []
    },
    {
      "bbox": [
        1700,
        2,
        1774,
        80
      ],
      "line_id": "leningrad_devarim_F118B_fixture_L003",
      "llm_tie_breaks": 0,
      "llm_winner": "claude",
      "tier1": "The text in the image appears to be in Latin script (reading \"genit\" or similar, upside down), not Hebrew. There is no Hebrew text visible to transcribe.",
      "tier2": "The text in the image appears to be in Latin script (reading \"genit\" or similar, upside down), not Hebrew. There is no Hebrew text visible to transcribe.",
      "tier3": "The text in the image appears to be in Latin script (reading \"genit\" or similar, upside down), not Hebrew. There is no Hebrew text visible to transcribe.",
      "tier4_records": []
    },
    {
      "bbox": [
        1977,
        5,
        2007,
        86
      ],
      "line_id": "leningrad_devarim_F118B_fixture_L004",
      "llm_tie_breaks": 1,
      "llm_winner": "claude",
      "tier1": "פִּ֣י",
      "tier2": "פִּ֣י",
      "tier3": "פִּ֣י",
      "tier4_records": []
    },
    {
      "bbox": [
        2384,
        29,
        2435,
        134
      ],
      "line_id": "leningrad_devarim_F118B_fixture_L005",
      "llm_tie_breaks": 1,
      "llm_winner": "claude",
      "tier1": "יְמֵ֣י",
      "tier2": "יְמֵ֣י",
      "tier3": "יְמֵ֣י",
      "tier4_records": []
    },
    {
      "bbox": [
        600,
        1979,
        669,
        2096
      ],
      "line_id": "leningrad_devarim_F118B_fixture_L008",
      "llm_tie_breaks": 1,
      "llm_winner": "claude",
      "tier1": "וַיְכַ֖ס",
      "tier2": "וַיְכַ֖ס",
      "tier3": "וַיְכַ֖ס",
      "tier4_records": []
    },
    {
      "bbox": [
        675,
        1439,
        761,
        1588
      ],
      "line_id": "leningrad_devarim_F118B_fixture_L009",
      "llm_tie_breaks": 1,
      "llm_winner": "claude",
      "tier1": "קְטֹ֖ל",
      "tier2": "קְטֹ֖ל",
      "tier3": "קְטֹ֖ל",
      "tier4_records": []
    },
    {
      "bbox": [
        618,
        2194,
        702,
        2281
      ],
      "line_id": "leningrad_devarim_F118B_fixture_L011",
      "llm_tie_breaks": 1,
      "llm_winner": "claude",
      "tier1": "וְחַ֖י",
      "tier2": "וְחַ֖י",
      "tier3": "וְחַ֖י",
      "tier4_records": []
    },
    {
      "bbox": [
        645,
        2373,
        726,
        2466
      ],
      "line_id": "leningrad_devarim_F118B_fixture_L013",
      "llm_tie_breaks": 1,
      "llm_winner": "claude",
      "tier1": "לְמַ֖י",
      "tier2": "לְמַ֖י",
      "tier3": "לְמַ֖י",
      "tier4_records": []
    },
    {
      "bbox": [
        558,
        2633,
        872,
        2765
      ],
      "line_id": "leningrad_devarim_F118B_fixture_L015",
      "llm_tie_breaks": 1,
      "llm_winner": "claude",
      "tier1": "אֲשֶׁ֣ר",
      "tier2": "אֲשֶׁ֣ר",
      "tier3": "אֲשֶׁ֣ר",
      "tier4_records": []
    },
    {
      "bbox": [
        546,
        2729,
        734,
        2842
      ],
      "line_id": "leningrad_devarim_F118B_fixture_L016",
      "llm_tie_breaks": 1,
      "llm_winner": "claude",
      "tier1": "כֹּ֖ל",
      "tier2": "כֹּ֖ל",
      "tier3": "כֹּ֖ל",
      "tier4_records": []
    },
    {
      "bbox": [
        576,
        2815,
        923,
        2941
      ],
      "line_id": "leningrad_devarim_F118B_fixture_L019",
      "llm_tie_breaks": 1,
      "llm_winner": "claude",
      "tier1": "וְחַד֩\nבִּצְבִיתְהֵ֨ן\nוְח",
      "tier2": "וְחַד֩\nבִּצְבִיתְהֵ֨ן\nוְח",
      "tier3": "וְחַד֩\nבִּצְבִיתְהֵ֨ן\nוְח",
      "tier4_records": []
    },
    {
      "bbox": [
        466,
        2914,
        890,
        3036
      ],
      "line_id": "leningrad_devarim_F118B_fixture_L021",
      "llm_tie_breaks": 1,
      "llm_winner": "claude",
      "tier1": "מוּטְבָּעֽוֹת",
      "tier2": "מוּטְבָּעֽוֹת",
      "tier3": "מוּטְבָּעֽוֹת",
      "tier4_records": []
    },
    {
      "bbox": [
        561,
        3195,
        645,
        3287
      ],
      "line_id": "leningrad_devarim_F118B_fixture_L022",
      "llm_tie_breaks": 1,
      "llm_winner": "claude",
      "tier1": "רֹב\nעַל\nפִּי",
      "tier2": "רֹב\nעַל\nפִּי",
      "tier3": "רֹב\nעַל\nפִּי",
      "tier4_records": []
    },
    {
      "bbox": [
        624,
        3015,
        729,
        3087
      ],
      "line_id": "leningrad_devarim_F118B_fixture_L023",
      "llm_tie_breaks": 1,
      "llm_winner": "claude",
      "tier1": "בְּנֵ֣י",
      "tier2": "בְּנֵ֣י",
      "tier3": "בְּנֵ֣י",
      "tier4_records": []
    },
    {
      "bbox": [
        624,
        3063,
        696,
        3210
      ],
      "line_id": "leningrad_devarim_F118B_fixture_L024",
      "llm_tie_breaks": 1,
      "llm_winner": "claude",
      "tier1": "הֵם",
      "tier2": "הֵם",
      "tier3": "הֵם",
      "tier4_records": []
    },
    {
      "bbox": [
        537,
        3257,
        660,
        3365
      ],
      "line_id": "leningrad_devarim_F118B_fixture_L025",
      "llm_tie_breaks": 1,
      "llm_winner": "claude",
      "tier1": "פֶּ֕ה\nוְאֶחָֽד׃",
      "tier2": "פֶּ֕ה\nוְאֶחָֽד׃",
      "tier3": "פֶּ֕ה\nוְאֶחָֽד׃",
      "tier4_records": []
    },
    {
      "bbox": [
        561,
        3260,
        717,
        3365
      ],
      "line_id": "leningrad_devarim_F118B_fixture_L026",
      "llm_tie_breaks": 1,
      "llm_winner": "claude",
      "tier1": "מִמֶּ֖נּוּ ׃ לֹ֥א",
      "tier2": "מִמֶּ֖נּוּ ׃ לֹ֥א",
      "tier3": "מִמֶּ֖נּוּ ׃ לֹ֥א",
      "tier4_records": []
    },
    {
      "bbox": [
        591,
        3344,
        639,
        3422
      ],
      "line_id": "leningrad_devarim_F118B_fixture_L027",
      "llm_tie_breaks": 1,
      "llm_winner": "claude",
      "tier1": "אִ֥ם",
      "tier2": "אִ֥ם",
      "tier3": "אִ֥ם",
      "tier4_records": []
    },
    {
      "bbox": [
        564,
        3395,
        657,
        3481
      ],
      "line_id": "leningrad_devarim_F118B_fixture_L028",
      "llm_tie_breaks": 1,
      "llm_winner": "claude",
      "tier1": "בְּמֵישָׁר",
      "tier2": "בְּמֵישָׁר",
      "tier3": "בְּמֵישָׁר",
      "tier4_records": []
    },
    {
      "bbox": [
        612,
        3451,
        657,
        3553
      ],
      "line_id": "leningrad_devarim_F118B_fixture_L029",
      "llm_tie_breaks": 1,
      "llm_winner": "claude",
      "tier1": "יִ֖י",
      "tier2": "יִ֖י",
      "tier3": "יִ֖י",
      "tier4_records": []
    },
    {
      "bbox": [
        1003,
        1164,
        3137,
        1295
      ],
      "line_id": "leningrad_devarim_F118B_fixture_L031",
      "llm_tie_breaks": 1,
      "llm_winner": "claude",
      "tier1": "וְאָעִ֣ידָה בָּ֔ם אֶת־הַשָּׁמַ֖יִם וְאֶת־הָאָ֑רֶץ כִּֽי־יָדַ֗עְתִּי",
      "tier2": "וְאָעִ֣ידָה בָּ֔ם אֶת־הַשָּׁמַ֖יִם וְאֶת־הָאָ֑רֶץ כִּֽי־יָדַ֗עְתִּי",
      "tier3": "וְאָעִ֣ידָה בָּ֔ם אֶת־הַשָּׁמַ֖יִם וְאֶת־הָאָ֑רֶץ כִּֽי־יָדַ֗עְתִּי",
      "tier4_records": []
    },
    {
      "bbox": [
        997,
        1260,
        1840,
        1385
      ],
      "line_id": "leningrad_devarim_F118B_fixture_L032",
      "llm_tie_breaks": 1,
      "llm_winner": "claude",
      "tier1": "וְשָׂרַפְתָּ֥ם בָּאֵ֖שׁ לֹא־תַחְמֹד֩",
      "tier2": "וְשָׂרַפְתָּ֥ם בָּאֵ֖שׁ לֹא־תַחְמֹד֩",
      "tier3": "וְשָׂרַפְתָּ֥ם בָּאֵ֖שׁ לֹא־תַחְמֹד֩",
      "tier4_records": []
    },
    {
      "bbox": [
        1003,
        1355,
        1389,
        1475
      ],
      "line_id": "leningrad_devarim_F118B_fixture_L033",
      "llm_tie_breaks": 1,
      "llm_winner": "claude",
      "tier1": "וְרָעֵ֖הוּ לֹֽא־יִ֝‎",
      "tier2": "וְרָעֵ֖הוּ לֹֽא־יִ֝‎",
      "tier3": "וְרָעֵ֖הוּ לֹֽא־יִ֝‎",
      "tier4_records": []
    },
    {
      "bbox": [
        1000,
        1454,
        1410,
        1570
      ],
      "line_id": "leningrad_devarim_F118B_fixture_L034",
      "llm_tie_breaks": 1,
      "llm_winner": "claude",
      "tier1": "יְהוָֹ֖ה ב",
      "tier2": "יְהוָֹ֖ה ב",
      "tier3": "יְהוָֹ֖ה ב",
      "tier4_records": []
    },
    {
      "bbox": [
        1428,
        1361,
        1852,
        1469
      ],
      "line_id": "leningrad_devarim_F118B_fixture_L035",
      "llm_tie_breaks": 1,
      "llm_winner": "claude",
      "tier1": "אֶתְכֶ֗ם",
      "tier2": "אֶתְכֶ֗ם",
      "tier3": "אֶתְכֶ֗ם",
      "tier4_records": []
    },
    {
      "bbox": [
        1452,
        1454,
        1834,
        1564
      ],
      "line_id": "leningrad_devarim_F118B_fixture_L036",
      "llm_tie_breaks": 1,
      "llm_winner": "claude",
      "tier1": "בְּעֵינֵ֘י",
      "tier2": "בְּעֵינֵ֘י",
      "tier3": "בְּעֵינֵ֘י",
      "tier4_records": []
    },
    {
      "bbox": [
        1006,
        1549,
        1837,
        1672
      ],
      "line_id": "leningrad_devarim_F118B_fixture_L037",
      "llm_tie_breaks": 1,
      "llm_winner": "claude",